{
  "$schema": "https://json-schema.org/draft/2020-12/schema",
  "$id": "https://example.org/pact/v1/schemas/event.schema.json",
  "title": "PACT event v0.1",
  "type": "object",
  "additionalProperties": false,
  "required": [
    "event_id",
    "task_id",
    "sequence",
    "type",
    "occurred_at",
    "correlation_id",
    "causation_id",
    "producer_id",
    "payload"
  ],
  "properties": {
    "event_id": {
      "type": "string",
      "minLength": 1
    },
    "task_id": {
      "type": "string",
      "minLength": 1
    },
    "sequence": {
      "type": "integer",
      "minimum": 0
    },
    "type": {
      "type": "string",
      "minLength": 1
    },
    "occurred_at": {
      "type": "string",
      "format": "date-time"
    },
    "correlation_id": {
      "type": "string",
      "minLength": 1
    },
    "causation_id": {
      "type": [
        "string",
        "null"
      ],
      "minLength": 1
    },
    "producer_id": {
      "type": "string",
      "minLength": 1
    },
    "payload": {
      "type": "object"
    },
    "sha256": {
      "type": "string",
      "pattern": "^[a-f0-9]{64}$"
    }
  }
}
